{
  "$schema": "https://json-schema.org/draft/2020-12/schema",
  "type": "object",
  "additionalProperties": false,
  "required": [
    "schema",
    "id",
    "time",
    "kind",
    "instance",
    "partition",
    "sequence",
    "previous_hash",
    "hash",
    "device_id",
    "installation_id",
    "namespace_id",
    "epoch",
    "principal",
    "pid",
    "intent_campaign_id",
    "intent_principal",
    "intent_subject",
    "session_id",
    "call_id",
    "cap_id",
    "parent_cap_id",
    "direction",
    "action",
    "interface_id",
    "method_id",
    "param_fields",
    "param_cap_ids",
    "param_hash",
    "result_code",
    "result_cap_ids",
    "event",
    "event_detail",
    "key_id",
    "signature"
  ],
  "$defs": {
    "admission_rule": {
      "description": "The admission rule nightfall refused a call by: not_caught_up (it has not read dusk.intended-processes to its end), process_without_intent (Dusk.process at a pid that no intended process of the node names), process_without_pid (Dusk.process with no pid), process_after_deadline (a call under a pid whose intended process expired or is gone, but Dusk.kill and Dusk.waitpid), command_budget (ShPortal.sh beyond the pid's max_commands), default_shell_without_intent (the default shell while no intended process of the node is open), default_shell_budget (ShPortal.sh in the default shell beyond the open processes' default_shell_commands).",
      "enum": [
        "not_caught_up",
        "process_without_intent",
        "process_without_pid",
        "process_after_deadline",
        "command_budget",
        "default_shell_without_intent",
        "default_shell_budget"
      ]
    }
  },
  "properties": {
    "schema": { "const": "dusk.ledger/v1" },
    "id": { "$ref": "common.schema.json#/$defs/id" },
    "time": { "$ref": "common.schema.json#/$defs/timestamp" },
    "kind": { "enum": ["call", "result", "event", "checkpoint"] },
    "instance": { "$ref": "common.schema.json#/$defs/instance" },
    "partition": { "type": "integer", "minimum": 0, "maximum": 9007199254740992 },
    "sequence": { "type": "integer", "minimum": 0, "maximum": 9007199254740992 },
    "previous_hash": {
      "description": "Hash of the previous entry in this (instance, partition) chain; 64 zeros at a chain start.",
      "$ref": "common.schema.json#/$defs/hash"
    },
    "hash": {
      "description": "SHA-256 of this entry's RFC 8785 canonical bytes with hash omitted.",
      "$ref": "common.schema.json#/$defs/hash"
    },
    "device_id": {
      "anyOf": [{ "$ref": "common.schema.json#/$defs/device_id" }, { "type": "null" }]
    },
    "installation_id": {
      "anyOf": [{ "$ref": "common.schema.json#/$defs/installation_id" }, { "type": "null" }]
    },
    "namespace_id": {
      "anyOf": [{ "$ref": "common.schema.json#/$defs/namespace_id" }, { "type": "null" }]
    },
    "epoch": {
      "anyOf": [{ "$ref": "common.schema.json#/$defs/epoch" }, { "type": "null" }]
    },
    "principal": { "type": "string", "minLength": 1 },
    "pid": {
      "description": "The pid of the process at the root of the call's capability provenance; 0 when the entry is under no process.",
      "$ref": "common.schema.json#/$defs/pid"
    },
    "intent_campaign_id": {
      "description": "The campaign of the intended process at pid when nightfall saw the call, from dusk.intended-processes; null when it has none or none was known.",
      "anyOf": [{ "$ref": "common.schema.json#/$defs/uuid" }, { "type": "null" }]
    },
    "intent_principal": {
      "description": "Who asked for the intended process at pid when nightfall saw the call; null when no intended process of the node was known at pid.",
      "type": ["string", "null"],
      "minLength": 1
    },
    "intent_subject": {
      "description": "What the intended process at pid is for, campaign:<campaign_id> or the operator; null exactly when intent_principal is.",
      "type": ["string", "null"],
      "minLength": 1
    },
    "session_id": {
      "anyOf": [{ "$ref": "common.schema.json#/$defs/uuid" }, { "type": "null" }]
    },
    "call_id": {
      "anyOf": [{ "$ref": "common.schema.json#/$defs/uuid" }, { "type": "null" }]
    },
    "cap_id": { "type": ["integer", "null"], "minimum": 0, "maximum": 9007199254740992 },
    "parent_cap_id": { "type": ["integer", "null"], "minimum": 0, "maximum": 9007199254740992 },
    "direction": { "enum": [null, "client_to_node", "node_to_client", "nightfall_to_node"] },
    "action": {
      "description": "Interface.method, or unknown:<interface id>.<method id> for a call on an interface the session's schema bundle does not hold.",
      "type": ["string", "null"],
      "pattern": "^([A-Za-z_][A-Za-z0-9_]*(\\.[A-Za-z_][A-Za-z0-9_]*)+|unknown:[0-9a-f]{16}\\.(0|[1-9][0-9]{0,4}))$"
    },
    "interface_id": { "type": ["string", "null"], "pattern": "^[0-9a-f]{16}$" },
    "method_id": { "type": ["integer", "null"], "minimum": 0, "maximum": 65535 },
    "param_fields": {
      "type": "array",
      "items": {
        "type": "object",
        "additionalProperties": false,
        "required": ["name", "redacted"],
        "properties": {
          "name": { "type": "string", "minLength": 1 },
          "redacted": { "type": "boolean" }
        }
      }
    },
    "param_cap_ids": {
      "type": "array",
      "items": { "type": "integer", "minimum": 0, "maximum": 9007199254740992 }
    },
    "param_hash": {
      "anyOf": [{ "const": "" }, { "$ref": "common.schema.json#/$defs/hash" }]
    },
    "result_code": {
      "enum": [
        null,
        "ok",
        "error:failed",
        "error:overloaded",
        "error:disconnected",
        "error:unimplemented",
        "denied",
        "rate_limited",
        "revoked",
        "cancelled"
      ]
    },
    "result_cap_ids": {
      "type": "array",
      "items": { "type": "integer", "minimum": 0, "maximum": 9007199254740992 }
    },
    "event": {
      "enum": [
        null,
        "session_open",
        "session_close",
        "membrane_dropped",
        "binding_conflict",
        "setup_call",
        "chain_link",
        "chain_resumed",
        "quarantine_override",
        "admission_override",
        "session_refused",
        "rpc_rejected"
      ]
    },
    "event_detail": {
      "description": "Open object on an event entry. session_refused: {reason: revoked, retired or setup_timeout}. rpc_rejected: {kind: the RPC message kind the filter aborted the connection on}. admission_override: {role: the exempt role, rule: the admission rule the call broke}. A denied call entry carries {rule} when admission refused it, otherwise null; every other entry carries null.",
      "type": ["object", "null"]
    },
    "key_id": { "type": ["string", "null"], "minLength": 1 },
    "signature": {
      "description": "Base64 Ed25519 signature over the RFC 8785 bytes of {instance, partition, sequence, hash} of the preceding entry.",
      "type": ["string", "null"],
      "pattern": "^[A-Za-z0-9+/]{86}==$"
    }
  },
  "allOf": [
    {
      "if": { "required": ["intent_principal"], "properties": { "intent_principal": { "type": "null" } } },
      "then": {
        "properties": { "intent_campaign_id": { "type": "null" }, "intent_subject": { "type": "null" } }
      },
      "else": { "properties": { "intent_subject": { "type": "string" } } }
    },
    {
      "if": { "required": ["kind"], "properties": { "kind": { "const": "checkpoint" } } },
      "then": {
        "properties": {
          "key_id": { "type": "string" },
          "signature": { "type": "string" },
          "device_id": { "type": "null" },
          "installation_id": { "type": "null" },
          "namespace_id": { "type": "null" },
          "epoch": { "type": "null" },
          "pid": { "const": "0" },
          "intent_principal": { "type": "null" },
          "session_id": { "type": "null" },
          "call_id": { "type": "null" },
          "cap_id": { "type": "null" },
          "parent_cap_id": { "type": "null" },
          "direction": { "type": "null" },
          "action": { "type": "null" },
          "interface_id": { "type": "null" },
          "method_id": { "type": "null" },
          "param_fields": { "maxItems": 0 },
          "param_cap_ids": { "maxItems": 0 },
          "param_hash": { "const": "" },
          "result_code": { "type": "null" },
          "result_cap_ids": { "maxItems": 0 }
        }
      },
      "else": {
        "properties": {
          "key_id": { "type": "null" },
          "signature": { "type": "null" }
        }
      }
    },
    {
      "if": { "required": ["kind"], "properties": { "kind": { "const": "event" } } },
      "then": {
        "properties": {
          "event": { "type": "string" },
          "param_hash": { "const": "" }
        }
      },
      "else": {
        "properties": {
          "event": { "type": "null" }
        }
      }
    },
    {
      "if": { "required": ["kind"], "properties": { "kind": { "enum": ["call", "result"] } } },
      "then": {
        "properties": {
          "device_id": { "type": "string" },
          "installation_id": { "type": "string" },
          "namespace_id": { "type": "string" },
          "epoch": { "type": "integer" },
          "session_id": { "type": "string" },
          "call_id": { "type": "string" },
          "cap_id": { "type": "integer" },
          "direction": { "type": "string" },
          "action": { "type": "string" },
          "interface_id": { "type": "string" },
          "method_id": { "type": "integer" }
        }
      }
    },
    {
      "if": { "required": ["kind"], "properties": { "kind": { "const": "call" } } },
      "then": {
        "properties": { "result_code": { "enum": [null, "denied", "rate_limited"] } },
        "if": { "required": ["result_code"], "properties": { "result_code": { "const": "denied" } } },
        "else": { "properties": { "param_hash": { "$ref": "common.schema.json#/$defs/hash" } } }
      }
    },
    {
      "if": {
        "required": ["kind", "result_code"],
        "properties": { "kind": { "const": "call" }, "result_code": { "const": "denied" } }
      },
      "then": {
        "properties": {
          "event_detail": {
            "anyOf": [
              { "type": "null" },
              {
                "type": "object",
                "additionalProperties": false,
                "required": ["rule"],
                "properties": { "rule": { "$ref": "#/$defs/admission_rule" } }
              }
            ]
          }
        }
      },
      "else": {
        "if": { "required": ["kind"], "properties": { "kind": { "const": "event" } } },
        "else": { "properties": { "event_detail": { "type": "null" } } }
      }
    },
    {
      "if": { "required": ["kind"], "properties": { "kind": { "const": "result" } } },
      "then": {
        "properties": {
          "param_hash": { "const": "" },
          "result_code": {
            "enum": [
              "ok",
              "error:failed",
              "error:overloaded",
              "error:disconnected",
              "error:unimplemented",
              "revoked",
              "cancelled"
            ]
          }
        }
      }
    },
    {
      "if": { "required": ["event"], "properties": { "event": { "const": "setup_call" } } },
      "then": {
        "properties": {
          "principal": { "const": "nightfall" },
          "direction": { "const": "nightfall_to_node" },
          "action": { "type": "string" },
          "interface_id": { "type": "string" },
          "method_id": { "type": "integer" },
          "session_id": { "type": "null" }
        }
      }
    },
    {
      "if": { "required": ["event"], "properties": { "event": { "const": "session_open" } } },
      "then": {
        "properties": {
          "device_id": { "type": "string" },
          "installation_id": { "type": "string" },
          "namespace_id": { "type": "string" },
          "epoch": { "type": "integer" },
          "session_id": { "type": "null" },
          "call_id": { "type": "null" }
        }
      }
    },
    {
      "if": { "required": ["event"], "properties": { "event": { "const": "session_close" } } },
      "then": {
        "properties": {
          "device_id": { "type": "string" },
          "installation_id": { "type": "string" },
          "namespace_id": { "type": "string" },
          "epoch": { "type": "integer" },
          "session_id": { "type": "null" },
          "call_id": { "type": "null" }
        }
      }
    },
    {
      "if": { "required": ["event"], "properties": { "event": { "const": "session_refused" } } },
      "then": {
        "properties": {
          "device_id": { "type": "string" },
          "installation_id": { "type": "string" },
          "epoch": { "type": "null" },
          "session_id": { "type": "null" },
          "call_id": { "type": "null" }
        }
      }
    },
    {
      "if": { "required": ["event"], "properties": { "event": { "const": "quarantine_override" } } },
      "then": {
        "properties": {
          "session_id": { "type": "string" },
          "call_id": { "type": "string" }
        }
      }
    },
    {
      "if": { "required": ["event"], "properties": { "event": { "const": "admission_override" } } },
      "then": {
        "properties": {
          "session_id": { "type": "string" },
          "call_id": { "type": "string" },
          "event_detail": {
            "type": "object",
            "additionalProperties": false,
            "required": ["role", "rule"],
            "properties": {
              "role": { "type": "string", "minLength": 1 },
              "rule": { "$ref": "#/$defs/admission_rule" }
            }
          }
        }
      }
    },
    {
      "if": { "required": ["event"], "properties": { "event": { "const": "membrane_dropped" } } },
      "then": {
        "properties": {
          "session_id": { "type": "string" },
          "call_id": { "type": "null" }
        }
      }
    },
    {
      "if": { "required": ["event"], "properties": { "event": { "const": "chain_link" } } },
      "then": {
        "properties": {
          "device_id": { "type": "null" },
          "installation_id": { "type": "null" },
          "namespace_id": { "type": "null" },
          "epoch": { "type": "null" },
          "session_id": { "type": "null" },
          "call_id": { "type": "null" }
        }
      }
    },
    {
      "if": { "required": ["event"], "properties": { "event": { "const": "chain_resumed" } } },
      "then": {
        "properties": {
          "device_id": { "type": "null" },
          "installation_id": { "type": "null" },
          "namespace_id": { "type": "null" },
          "epoch": { "type": "null" },
          "session_id": { "type": "null" },
          "call_id": { "type": "null" }
        }
      }
    },
    {
      "if": { "required": ["event"], "properties": { "event": { "const": "binding_conflict" } } },
      "then": {
        "properties": {
          "epoch": { "type": "null" },
          "session_id": { "type": "null" },
          "call_id": { "type": "null" }
        }
      }
    },
    {
      "if": { "required": ["event"], "properties": { "event": { "const": "rpc_rejected" } } },
      "then": {
        "properties": {
          "call_id": { "type": "null" }
        }
      }
    },
    {
      "if": {
        "required": ["action"],
        "properties": { "action": { "type": "string", "pattern": "^unknown:" } }
      },
      "then": {
        "properties": {
          "kind": { "const": "call" },
          "result_code": { "const": "denied" },
          "param_hash": { "const": "" }
        }
      }
    }
  ]
}
