{
  "schema": "dusk.ledger/v1",
  "id": "01a112fe-d1bb-72ae-b6bf-fede95a92daa",
  "time": "2026-10-06T09:22:20.512408617Z",
  "kind": "event",
  "instance": "nightfall-0",
  "partition": 0,
  "sequence": 4022,
  "previous_hash": "4c1e9a7f3b5d2e8c0a6f4b1d9e7c3a5f2b8d0e6c4a1f9b7d5e3c2a0f8b6d4e1c",
  "hash": "a7d3f1c9e5b2084f6a1d3c5e7b9f0a2c4e6d8b1f3a5c7e9d0b2f4a6c8e1d3b5f",
  "device_id": null,
  "installation_id": null,
  "namespace_id": null,
  "epoch": null,
  "principal": "nightfall",
  "pid": "0",
  "intent_campaign_id": null,
  "intent_principal": null,
  "intent_subject": null,
  "session_id": null,
  "call_id": null,
  "cap_id": null,
  "parent_cap_id": null,
  "direction": null,
  "action": null,
  "interface_id": null,
  "method_id": null,
  "param_fields": [],
  "param_cap_ids": [],
  "param_hash": "",
  "result_code": null,
  "result_cap_ids": [],
  "event": "chain_resumed",
  "event_detail": {
    "sequence": 4021,
    "hash": "4c1e9a7f3b5d2e8c0a6f4b1d9e7c3a5f2b8d0e6c4a1f9b7d5e3c2a0f8b6d4e1c"
  },
  "key_id": null,
  "signature": null
}
