{
  "schema": "dusk.ledger/v1",
  "id": "01a112fe-d1ba-7684-ae83-5243b8d1c205",
  "time": "2026-10-06T09:15:38.512408215Z",
  "kind": "event",
  "instance": "nightfall-0",
  "partition": 0,
  "sequence": 40,
  "previous_hash": "4c1e9a7f3b5d2e8c0a6f4b1d9e7c3a5f2b8d0e6c4a1f9b7d5e3c2a0f8b6d4e1c",
  "hash": "a7d3f1c9e5b2084f6a1d3c5e7b9f0a2c4e6d8b1f3a5c7e9d0b2f4a6c8e1d3b5f",
  "device_id": "3f9c0e2a7b5d4c1e8a6f0b2d9e7c5a13",
  "installation_id": "a41e6c2f9b0d4e7a8c3f5b1d2e9a6c70",
  "namespace_id": "5d2e9a1c7b3f8e04",
  "epoch": 1791278043512408,
  "principal": "nightfall",
  "pid": "0",
  "intent_campaign_id": null,
  "intent_principal": null,
  "intent_subject": null,
  "session_id": null,
  "call_id": null,
  "cap_id": null,
  "parent_cap_id": null,
  "direction": "nightfall_to_node",
  "action": "Dusk.programs",
  "interface_id": "ace6963097d486d7",
  "method_id": 8,
  "param_fields": [],
  "param_cap_ids": [],
  "param_hash": "",
  "result_code": null,
  "result_cap_ids": [],
  "event": "setup_call",
  "event_detail": null,
  "key_id": null,
  "signature": null
}
