{
  "schema": "dusk.ledger/v1",
  "id": "01a112fe-d1bb-72ae-b6bf-fedf86003e42",
  "time": "2026-10-06T09:17:40.512408337Z",
  "kind": "event",
  "instance": "nightfall-0",
  "partition": 0,
  "sequence": 140,
  "previous_hash": "4c1e9a7f3b5d2e8c0a6f4b1d9e7c3a5f2b8d0e6c4a1f9b7d5e3c2a0f8b6d4e1c",
  "hash": "a7d3f1c9e5b2084f6a1d3c5e7b9f0a2c4e6d8b1f3a5c7e9d0b2f4a6c8e1d3b5f",
  "device_id": "3f9c0e2a7b5d4c1e8a6f0b2d9e7c5a13",
  "installation_id": "a41e6c2f9b0d4e7a8c3f5b1d2e9a6c70",
  "namespace_id": "5d2e9a1c7b3f8e04",
  "epoch": 1791278043512408,
  "principal": "dawn-1",
  "pid": "4153296812709138211",
  "intent_campaign_id": null,
  "intent_principal": null,
  "intent_subject": null,
  "session_id": "0192f3a4-b000-7b2c-9d3e-4f5061728394",
  "call_id": "0192f3a4-b001-7b2c-9d3e-4f5061728394",
  "cap_id": 4,
  "parent_cap_id": 2,
  "direction": "client_to_node",
  "action": "ShPortal.sh",
  "interface_id": "e1c5b0f3a7d29c48",
  "method_id": 0,
  "param_fields": [],
  "param_cap_ids": [],
  "param_hash": "",
  "result_code": null,
  "result_cap_ids": [],
  "event": "quarantine_override",
  "event_detail": {
    "role": "incident-response"
  },
  "key_id": null,
  "signature": null
}
